input,summary
"Artificial intelligence is transforming industries by automating tasks, analyzing data, and enabling new products and services. Its applications range from healthcare diagnostics to autonomous vehicles and personalized recommendations.","AI automates tasks and enables innovation across industries."
"Climate change is causing rising sea levels, extreme weather events, and biodiversity loss. Governments and organizations are working to reduce emissions and promote renewable energy to address these challenges.","Climate change leads to severe impacts, prompting efforts to cut emissions and use renewable energy."
"Remote work has become more common due to advances in technology and the COVID-19 pandemic. It offers flexibility but also presents challenges in communication and work-life balance.","Remote work is more common, offering flexibility but also communication and balance challenges."
"Electric vehicles are gaining popularity as a sustainable alternative to gasoline cars. Improvements in battery technology and charging infrastructure are making EVs more accessible to consumers.","Electric vehicles are becoming popular due to better batteries and charging options."
"Social media platforms connect people globally, allowing instant sharing of information and ideas. However, they also raise concerns about privacy, misinformation, and mental health.","Social media connects people but raises issues like privacy, misinformation, and mental health."
"Renewable energy sources such as solar and wind are essential for reducing dependence on fossil fuels. Investments in clean energy are increasing as countries aim to meet climate goals.","Solar and wind energy help reduce fossil fuel use and support climate goals."
"Online education platforms provide access to learning resources for students worldwide. They offer flexibility and a wide range of courses, but require self-discipline and reliable internet access.","Online education offers flexible learning but needs self-discipline and good internet."
"Space exploration has led to technological advancements and a better understanding of our universe. Recent missions focus on Mars, the Moon, and searching for extraterrestrial life.","Space exploration advances technology and expands our knowledge of the universe."
"Blockchain technology enables secure, decentralized transactions and is the foundation of cryptocurrencies like Bitcoin. It is also being explored for supply chain management and digital identity.","Blockchain secures transactions and powers cryptocurrencies, with uses in supply chains and identity."
"Urbanization is increasing as more people move to cities for economic opportunities. This trend creates challenges in housing, transportation, and infrastructure development.","Urbanization brings economic growth but challenges in housing and infrastructure."
"Machine learning algorithms can identify patterns in large datasets, improving decision-making in fields like finance, healthcare, and marketing.","Machine learning finds patterns in data to improve decisions in various fields."
"Telemedicine allows patients to consult doctors remotely, increasing access to healthcare in rural and underserved areas.","Telemedicine enables remote doctor consultations, improving healthcare access."
"Genetic engineering is used to modify organisms for agriculture, medicine, and research. It raises ethical questions about safety and long-term effects.","Genetic engineering modifies organisms for various uses but raises ethical concerns."
"Cloud computing provides scalable storage and computing power over the internet, enabling businesses to operate more efficiently and cost-effectively.","Cloud computing offers scalable online storage and computing for businesses."
"3D printing technology allows rapid prototyping and manufacturing of complex objects, revolutionizing industries from healthcare to aerospace.","3D printing enables fast prototyping and manufacturing in many industries."
"Cybersecurity threats such as hacking and data breaches are increasing, prompting organizations to invest in stronger security measures.","Rising cybersecurity threats drive investment in better security."
"Virtual reality creates immersive digital environments for gaming, training, and education, offering new ways to experience information and entertainment.","Virtual reality offers immersive experiences for gaming, training, and learning."
"Big data analytics helps organizations extract insights from massive datasets, supporting better business strategies and operations.","Big data analytics provides insights for improved business strategies."
"Biodegradable materials are being developed to reduce plastic pollution and environmental impact, especially in packaging and consumer goods.","Biodegradable materials help reduce plastic pollution and environmental harm."
"Quantum computing promises to solve complex problems much faster than traditional computers, with potential applications in cryptography and drug discovery.","Quantum computing could solve complex problems faster than regular computers."
"Renewable energy storage solutions, such as advanced batteries, are crucial for integrating solar and wind power into the grid.","Advanced energy storage is key for using more solar and wind power."
"Personalized medicine tailors treatments to individual genetic profiles, improving effectiveness and reducing side effects.","Personalized medicine customizes treatments for better results."
"Autonomous drones are used for delivery, surveillance, and disaster response, increasing efficiency and safety in various sectors.","Autonomous drones improve efficiency in delivery, surveillance, and emergencies."
"Augmented reality overlays digital information on the real world, enhancing experiences in retail, education, and navigation.","Augmented reality adds digital info to real-world experiences."
"Smart home devices automate tasks like lighting, security, and temperature control, making homes more convenient and energy-efficient.","Smart home devices automate and improve home convenience and efficiency."
"Electric aircraft are being developed to reduce emissions and noise in aviation, with several prototypes already in testing.","Electric aircraft aim to lower aviation emissions and noise."
"Digital currencies like Bitcoin and Ethereum are changing how people store and transfer value, but face regulatory and security challenges.","Digital currencies change value transfer but face regulation and security issues."
"Gene editing tools like CRISPR allow precise changes to DNA, offering potential cures for genetic diseases but raising ethical debates.","CRISPR enables precise gene editing, offering cures but raising ethical issues."
"Smart agriculture uses sensors, drones, and AI to optimize crop yields and resource use, making farming more sustainable.","Smart agriculture uses tech to boost yields and sustainability."
"5G networks provide faster wireless connectivity, enabling new applications in IoT, autonomous vehicles, and smart cities.","5G networks offer faster wireless connections for new tech applications."
"Digital twins are virtual models of physical systems, used to monitor and optimize performance in manufacturing and infrastructure.","Digital twins simulate real systems for better monitoring and optimization."
"Contactless payment systems have grown in popularity, offering convenience and reducing the spread of germs during transactions.","Contactless payments offer convenience and reduce germ transmission."
"Smart wearables track health metrics like heart rate and activity, helping users monitor fitness and detect health issues early.","Wearables track health and fitness, aiding early issue detection."
"Biometric authentication uses fingerprints, facial recognition, or voice to secure devices and accounts, improving security.","Biometric authentication secures devices using unique physical traits."
"Green buildings use sustainable materials and energy-efficient designs to reduce environmental impact and operating costs.","Green buildings lower environmental impact and save energy."
"Digital marketing leverages data analytics and targeted ads to reach consumers more effectively online.","Digital marketing uses data to target consumers more effectively."
"Robotic process automation automates repetitive business tasks, increasing efficiency and reducing errors.","Robotic automation streamlines repetitive business tasks."
"Smart grids use digital technology to manage electricity distribution, improving reliability and integrating renewable energy.","Smart grids enhance electricity management and support renewables."
"Voice assistants like Alexa and Siri help users perform tasks, control devices, and access information using natural language.","Voice assistants help users with tasks and information via speech."
"Telehealth platforms provide remote medical consultations, prescriptions, and monitoring, expanding healthcare access.","Telehealth expands access to medical care remotely."
"Edge computing processes data closer to the source, reducing latency and bandwidth use in applications like IoT and autonomous vehicles.","Edge computing processes data locally for faster response."
"Digital identity systems streamline authentication for online services, improving security and user experience.","Digital identity systems simplify and secure online authentication."
"Smart cities use sensors and data analytics to improve urban services, traffic management, and sustainability.","Smart cities use tech to enhance services and sustainability."
"Plant-based meat alternatives are gaining popularity as sustainable food options, reducing reliance on animal agriculture.","Plant-based meats offer sustainable alternatives to animal products."
"Mobile health apps help users track symptoms, medication, and wellness, supporting preventive care and chronic disease management.","Health apps help users monitor wellness and manage conditions."
"Flexible electronics enable new device designs, such as foldable phones and wearable sensors, expanding possibilities in consumer tech.","Flexible electronics allow innovative device designs like foldable phones."
"Digital therapeutics use software to treat medical conditions, often complementing traditional therapies for mental health and chronic diseases.","Digital therapeutics use software to support medical treatment."
"Smart transportation systems use real-time data to optimize traffic flow, reduce congestion, and improve safety.","Smart transportation optimizes traffic and improves safety."
"Energy-efficient appliances reduce electricity consumption and lower utility bills, contributing to environmental sustainability.","Energy-efficient appliances save energy and reduce costs."
"Online collaboration tools enable teams to work together remotely, increasing productivity and flexibility.","Collaboration tools support remote teamwork and productivity."
"Precision agriculture uses GPS, sensors, and data analytics to optimize planting, irrigation, and fertilization, increasing yields and reducing waste.","Precision agriculture boosts yields and reduces waste with tech."
"Digital supply chains use real-time tracking and analytics to improve efficiency, transparency, and responsiveness to disruptions.","Digital supply chains enhance efficiency and transparency."
"Smart water management systems monitor usage and detect leaks, helping conserve water and reduce costs.","Smart water systems conserve water and cut costs."
"Electric scooters and bikes offer convenient, eco-friendly transportation options in urban areas, reducing traffic and emissions.","E-scooters and bikes provide green urban transport."
"Digital health records centralize patient information, improving care coordination and reducing errors.","Digital health records improve care and reduce errors."
"Smart retail uses data analytics, automation, and personalized experiences to enhance shopping and streamline operations.","Smart retail uses tech to improve shopping and operations."
"Remote patient monitoring uses connected devices to track health metrics and alert providers to potential issues.","Remote monitoring tracks patient health and alerts providers."
"Digital art and NFTs are changing how artists create, sell, and authenticate their work, opening new revenue streams.","Digital art and NFTs transform art creation and sales."
"Smart waste management uses sensors and data to optimize collection routes and reduce landfill use.","Smart waste management optimizes collection and reduces landfill."
"Online mental health services provide therapy and support through digital platforms, increasing accessibility and privacy.","Online mental health services increase access and privacy."
"Smart parking systems use sensors and apps to help drivers find available spaces, reducing congestion and frustration.","Smart parking helps drivers find spaces and reduces congestion."
"Digital twins in healthcare model organs and systems to personalize treatment and improve outcomes.","Healthcare digital twins personalize treatment and improve outcomes."
"Smart lighting systems adjust brightness and color based on occupancy and natural light, saving energy and improving comfort.","Smart lighting saves energy and enhances comfort."
"Digital agriculture platforms connect farmers with markets, resources, and information, improving productivity and income.","Digital agriculture platforms boost farmer productivity and income."
"Smart grids enable two-way communication between utilities and consumers, supporting demand response and renewable integration.","Smart grids support two-way communication and renewables."
"Online language learning platforms offer interactive lessons and practice with native speakers, making language acquisition more accessible.","Online language platforms make learning languages easier."
"Digital forensics tools help investigators analyze electronic evidence in cybercrime cases, improving law enforcement capabilities.","Digital forensics aids cybercrime investigations."
"Smart thermostats learn user preferences and adjust heating and cooling to save energy and increase comfort.","Smart thermostats save energy and improve comfort."
"Digital literacy programs teach essential technology skills, helping people participate in the digital economy.","Digital literacy programs build essential tech skills."
"Smart farming robots automate planting, weeding, and harvesting, increasing efficiency and reducing labor costs.","Farming robots automate tasks and cut labor costs."
"Online fitness platforms offer virtual classes, personalized workouts, and progress tracking, making exercise more accessible.","Online fitness platforms provide virtual workouts and tracking."
"Digital banking services allow customers to manage accounts, transfer funds, and access loans online, increasing convenience and financial inclusion.","Digital banking offers convenient online financial services."
"Smart irrigation systems use weather data and soil sensors to optimize watering, conserving water and improving crop yields.","Smart irrigation conserves water and boosts yields."
"Digital literacy is essential for navigating online information, protecting privacy, and avoiding scams.","Digital literacy helps people use the internet safely and effectively."
"Smart glasses display information and notifications in the user's field of view, supporting hands-free tasks and navigation.","Smart glasses provide hands-free info and navigation."
"Online grocery delivery services offer convenience and time savings, especially during the COVID-19 pandemic.","Online grocery delivery offers convenience and saves time."
"Digital twins in manufacturing simulate production processes, enabling optimization and predictive maintenance.","Manufacturing digital twins optimize production and maintenance."
"Smart sensors monitor air quality, temperature, and humidity in buildings, improving comfort and health.","Smart sensors improve building comfort and air quality."
"Online coding bootcamps teach programming skills quickly, helping people switch careers or advance in tech fields.","Coding bootcamps teach programming for tech careers."
"Digital marketing automation streamlines campaign management, targeting, and analytics, increasing efficiency and ROI.","Marketing automation streamlines campaigns and boosts ROI."
"Smart meters provide real-time energy usage data to consumers and utilities, supporting energy conservation.","Smart meters give real-time energy data for conservation."
"Online legal services offer document preparation, consultations, and dispute resolution, making legal help more accessible.","Online legal services make legal help more accessible."
"Digital pathology uses high-resolution images and AI to assist in disease diagnosis and research.","Digital pathology uses images and AI for better diagnosis."
"Smart logistics platforms optimize shipping routes, inventory, and delivery schedules, reducing costs and improving service.","Smart logistics optimize shipping and reduce costs."
"Online investment platforms provide access to stocks, bonds, and other assets, democratizing investing.","Online investment platforms make investing accessible."
"Digital twins in construction model buildings and infrastructure, improving design, planning, and maintenance.","Construction digital twins improve design and maintenance."
"Smart kitchen appliances automate cooking and monitor food safety, making meal preparation easier and safer.","Smart kitchen appliances automate and improve cooking."
"Online tutoring platforms connect students with qualified teachers, offering personalized learning experiences.","Online tutoring offers personalized learning with expert teachers."
"Digital health wearables monitor vital signs and activity, supporting preventive care and early intervention.","Health wearables monitor vitals for preventive care."
"Smart traffic lights use sensors and data to optimize signal timing, reducing congestion and improving safety.","Smart traffic lights reduce congestion and improve safety."
"Online event platforms host virtual conferences, meetings, and networking, expanding access and participation.","Online event platforms enable virtual conferences and networking."
"Digital twins in energy manage power plants and grids, optimizing performance and reducing downtime.","Energy digital twins optimize power plant and grid performance."
"Smart pet devices track activity, health, and location, helping owners care for their animals.","Smart pet devices monitor pet health and location."
"Online art galleries showcase and sell artwork to a global audience, supporting artists and collectors.","Online art galleries connect artists and buyers worldwide."
"Digital supply chain finance platforms streamline payments and improve cash flow for businesses.","Supply chain finance platforms improve payments and cash flow."
"Smart clothing integrates sensors to monitor health, activity, and environment, offering new possibilities in fashion and wellness.","Smart clothing tracks health and activity for wellness."
"Online therapy platforms provide mental health support through video, chat, and phone, increasing accessibility.","Online therapy platforms make mental health support accessible."
"Digital twins in transportation model traffic and infrastructure, supporting planning and congestion management.","Transportation digital twins aid planning and reduce congestion."
"Smart classroom technology enhances teaching and learning with interactive displays, devices, and software.","Smart classroom tech improves teaching and learning."
"Online job platforms match candidates with employers, streamlining recruitment and expanding opportunities.","Job platforms match candidates and employers efficiently."
"Digital twins in logistics simulate supply chains, improving efficiency and resilience to disruptions.","Logistics digital twins improve supply chain efficiency."
"Smart medical devices monitor patient health and deliver treatments, supporting personalized care.","Smart medical devices support personalized patient care."
"Online music streaming services offer vast libraries and personalized recommendations, changing how people listen to music.","Music streaming services provide vast libraries and recommendations."
"Digital twins in mining optimize operations, safety, and resource management, increasing productivity.","Mining digital twins boost productivity and safety."
"Smart home security systems use cameras, sensors, and AI to detect threats and alert homeowners.","Smart home security detects threats and alerts homeowners."
"Online travel booking platforms compare prices and options, making trip planning easier and more affordable.","Travel booking platforms simplify and save on trip planning."
"Digital twins in oil and gas monitor equipment and processes, reducing downtime and improving safety.","Oil and gas digital twins improve monitoring and safety."
"Smart hospital systems coordinate patient care, resources, and workflows, improving efficiency and outcomes.","Smart hospital systems improve care coordination and efficiency."
"Online food delivery platforms connect customers with restaurants, offering convenience and variety.","Food delivery platforms offer convenience and restaurant variety."
"Digital twins in agriculture model crops and livestock, supporting precision farming and sustainability.","Agriculture digital twins support precision farming."
"Smart building management systems control lighting, HVAC, and security, reducing costs and improving comfort.","Smart building systems cut costs and improve comfort."
"Online learning management systems organize courses, assignments, and communication for students and teachers.","Learning management systems organize online education."
"Digital twins in water management optimize supply, quality, and infrastructure maintenance.","Water management digital twins optimize supply and maintenance."
"Smart grid cybersecurity protects energy infrastructure from digital threats and attacks.","Smart grid cybersecurity defends energy systems from attacks."
"Online car buying platforms let consumers research, compare, and purchase vehicles remotely.","Car buying platforms enable remote research and purchase."
"Digital twins in ports and shipping optimize logistics, reduce congestion, and improve safety.","Port digital twins optimize shipping and safety."
"Smart waste sorting systems use AI and robotics to separate recyclables, improving recycling rates.","Smart waste sorting boosts recycling with AI and robotics."
"Online real estate platforms list properties, provide virtual tours, and connect buyers with agents.","Real estate platforms offer listings and virtual tours."
"Digital twins in airports manage operations, passenger flow, and maintenance, enhancing efficiency.","Airport digital twins improve operations and efficiency."
"Smart farming platforms analyze weather, soil, and crop data to guide decisions and maximize yields.","Farming platforms use data to maximize crop yields."
"Online insurance platforms offer quotes, policy management, and claims processing, increasing convenience.","Insurance platforms provide online quotes and claims."
"Digital twins in wind energy monitor turbines and predict maintenance needs, reducing downtime.","Wind energy digital twins monitor turbines and cut downtime."
"Smart city lighting systems adjust brightness based on activity and daylight, saving energy and improving safety.","City lighting systems save energy and improve safety."
"Online tax filing platforms guide users through returns, increasing accuracy and reducing errors.","Tax filing platforms simplify and improve accuracy."
"Digital twins in railways monitor tracks and trains, supporting maintenance and safety.","Railway digital twins support maintenance and safety."
"Smart farming drones monitor crops, apply treatments, and collect data, increasing efficiency.","Farming drones monitor crops and boost efficiency."
"Online appointment scheduling platforms streamline bookings for businesses and customers.","Appointment platforms simplify scheduling for all."
"Digital twins in water utilities detect leaks and optimize distribution, reducing waste.","Water utility twins detect leaks and cut waste."
"Smart city air quality monitoring uses sensors to track pollution and inform public health actions.","Air quality sensors track pollution for public health."
"Online voting platforms aim to increase participation and accessibility in elections.","Online voting platforms boost election participation."
"Digital twins in bridges and tunnels monitor structural health, supporting maintenance and safety.","Bridge digital twins monitor structure and safety."
"Smart farming weather stations provide real-time data to guide planting and irrigation decisions.","Weather stations give real-time data for farming."
"Online subscription services deliver products regularly, offering convenience and customization.","Subscription services offer regular, customized deliveries."
"Digital twins in factories simulate production lines, improving efficiency and reducing downtime.","Factory digital twins improve production efficiency."
"Smart city waste bins signal when full, optimizing collection routes and reducing costs.","Smart waste bins optimize collection and cut costs."
"Online personal finance platforms help users budget, save, and invest, improving financial health.","Personal finance platforms help users manage money."
"Digital twins in pipelines monitor flow and detect leaks, improving safety and efficiency.","Pipeline twins monitor flow and detect leaks."
"Smart farming irrigation controllers adjust watering based on soil and weather data, conserving water.","Irrigation controllers save water with smart adjustments."
