input,summary
"Vaccination campaigns are crucial for public health, preventing the spread of infectious diseases and saving countless lives. Herd immunity protects vulnerable populations who cannot be vaccinated. Continued efforts are needed to address vaccine hesitancy and ensure global access.","Vaccination campaigns are vital for public health, preventing disease, and achieving herd immunity, though vaccine hesitancy and global access remain challenges."
"Adult education and reskilling programs are essential for adapting to a changing job market. Continuous professional development helps individuals stay competitive and relevant. These programs offer opportunities for career advancement and personal enrichment.","Adult education and reskilling are crucial for adapting to job market changes, offering career advancement and personal enrichment."
"Renewable energy sources like solar and wind power are critical for combating climate change. Investing in these technologies reduces reliance on fossil fuels and promotes a cleaner environment. Government policies and public support are essential for their widespread adoption.","Renewable energy is crucial for climate change, reducing fossil fuel reliance, and promoting a cleaner environment with policy and public support."
"Genetic engineering holds immense promise for treating diseases and improving crop yields. Modifying genes can correct inherited disorders or enhance desirable traits. However, ethical debates surrounding its application continue to be a significant concern.","Genetic engineering promises disease treatment and crop improvement through gene modification, but faces ongoing ethical debates."
"Telecommuting and remote work have become increasingly prevalent, offering flexibility and reducing commuting times. This shift impacts urban planning and office space demands. Effective communication tools are vital for dispersed teams.","Remote work offers flexibility, impacts urban planning, and requires effective communication for dispersed teams."
"The development of quantum cryptography offers ultra-secure communication methods. Utilizing principles of quantum mechanics, it prevents eavesdropping by making any interference detectable. This technology is crucial for protecting sensitive data in the future.","Quantum cryptography offers ultra-secure, un-eavesdroppable communication, crucial for future sensitive data protection."
"Space exploration continues to push the boundaries of human knowledge and technology. Missions to other planets and the study of the cosmos reveal insights into the universe's origins. These endeavors inspire scientific curiosity and technological innovation.","Space exploration expands human knowledge, reveals cosmic insights, and inspires scientific and technological innovation."
"The increasing adoption of electric vehicles (EVs) is a key step towards sustainable transportation. EVs reduce air pollution and reliance on fossil fuels. Expanding charging infrastructure and improving battery technology are critical for mass adoption.","EVs are crucial for sustainable transport, reducing pollution and fossil fuel reliance, needing improved charging and battery tech."
"The evolution of augmented reality (AR) in mobile applications is changing how we interact with the digital world. AR overlays digital information onto real-world views, enhancing user experience in various sectors. Its potential for integration into daily life is vast.","AR in mobile apps transforms digital interaction by overlaying digital info onto reality, with vast integration potential."
"Precision agriculture utilizes technology like GPS and sensors to optimize crop yields and reduce resource waste. This approach improves efficiency, sustainability, and profitability for farmers. Data analysis plays a crucial role in decision-making.","Precision agriculture uses technology to optimize crop yields, reduce waste, and improve sustainability through data analysis."
"The rise of wearable technology, from smartwatches to fitness trackers, provides continuous health monitoring and data. These devices empower individuals to take a more proactive role in managing their well-being. Data privacy and accuracy are ongoing considerations.","Wearable technology offers continuous health monitoring, empowering individuals, but raises data privacy and accuracy concerns."
"Artificial neural networks, a core component of deep learning, mimic the human brain's structure to process data. These networks enable advanced pattern recognition and predictive analytics. Their application spans from image recognition to natural language processing.","Artificial neural networks, mimicking the brain, enable advanced pattern recognition and predictive analytics for various applications."
"The concept of a 'digital twin' involves creating a virtual replica of a physical object or system. This allows for real-time monitoring, analysis, and optimization of performance. Digital twins are increasingly used in manufacturing, healthcare, and smart cities.","Digital twins create virtual replicas for real-time monitoring, analysis, and optimization in manufacturing, healthcare, and smart cities."
"The growing field of bioinformatics combines biology with computer science to analyze complex biological data. It plays a vital role in drug discovery, genomics, and personalized medicine. Understanding genetic sequences is key to many breakthroughs.","Bioinformatics combines biology and computer science to analyze complex biological data, crucial for drug discovery, genomics, and personalized medicine."
"Edge computing processes data closer to its source, reducing latency and bandwidth usage. This is particularly important for IoT devices and real-time applications. It enhances efficiency and responsiveness in distributed systems.","Edge computing processes data near its source, reducing latency and bandwidth for IoT and real-time applications, enhancing efficiency."
"The development of advanced robotics is transforming industries from manufacturing to healthcare. Robots perform tasks with precision and efficiency, improving productivity and safety. Ethical considerations regarding automation and human-robot interaction are paramount.","Advanced robotics is transforming industries by improving productivity and safety, but raises ethical concerns about automation and human-robot interaction."
"Biometric authentication, using unique biological characteristics like fingerprints or facial features, enhances security. It offers a more convenient and robust alternative to traditional passwords. Privacy implications and data storage are important concerns.","Biometric authentication, using unique biological features, improves security and convenience but raises privacy and data storage concerns."
"The impact of nanotechnology on materials science is profound, creating novel materials with enhanced properties. Applications range from stronger composites to more efficient electronics. Research in this field continues to unlock new possibilities.","Nanotechnology profoundly impacts materials science, creating novel materials with enhanced properties for various applications, unlocking new possibilities."
"The increasing use of drones for delivery, surveillance, and mapping is revolutionizing various sectors. Drones offer flexibility and efficiency for tasks that are difficult or dangerous for humans. Regulatory frameworks are evolving to manage their widespread use.","Drones are revolutionizing delivery, surveillance, and mapping by offering flexibility and efficiency, though regulations are still evolving."
"The role of big data analytics in decision-making is becoming indispensable for businesses and organizations. Analyzing vast datasets reveals patterns, trends, and associations. Ethical data usage and privacy protection are critical considerations.","Big data analytics is crucial for informed decision-making, revealing patterns and trends from vast datasets, with ethical usage and privacy paramount."
"The advancement of reusable rocket technology is significantly reducing the cost of space launches. This innovation makes space more accessible for scientific research and commercial endeavors. It marks a new era in aerospace engineering.","Reusable rocket technology reduces space launch costs, making space more accessible for research and commerce, marking a new aerospace era."
"Haptic technology provides tactile feedback, enhancing immersive experiences in virtual reality and gaming. It allows users to 'feel' digital objects and environments, improving realism and interaction. Its applications are expanding into various fields.","Haptic technology provides tactile feedback, enhancing VR/gaming immersion by allowing users to 'feel' digital objects and expanding applications."
"The development of sustainable construction materials aims to reduce the environmental footprint of buildings. Using recycled content, renewable resources, and energy-efficient designs contributes to greener infrastructure. Innovation in this area is crucial for urban development.","Sustainable construction materials reduce buildings' environmental footprint through recycled content, renewables, and energy-efficient designs, crucial for urban development."
"The importance of regular physical activity for children's development is paramount. It improves motor skills, cognitive function, and fosters healthy habits. Encouraging outdoor play and organized sports contributes to overall well-being.","Regular physical activity is vital for children's motor skills, cognitive function, and healthy habits, promoting overall well-being."
"The benefits of a plant-based diet for heart health and environmental sustainability are increasingly recognized. Reducing meat consumption can lower cholesterol and carbon footprint. A well-planned plant-based diet provides all necessary nutrients.","Plant-based diets benefit heart health and sustainability by lowering cholesterol and carbon footprint, providing essential nutrients."
"Mind-body exercises like Tai Chi and Qigong promote relaxation, balance, and improved physical well-being. These ancient practices integrate slow movements, deep breathing, and meditation. Regular practice enhances vitality and reduces stress.","Mind-body exercises like Tai Chi and Qigong enhance relaxation, balance, and physical well-being through slow movements, breathing, and meditation."
"The increasing prevalence of chronic diseases highlights the need for lifestyle interventions. Regular exercise, healthy eating, and stress management can significantly reduce risk factors. Empowering individuals to make healthier choices is a public health priority.","Rising chronic diseases necessitate lifestyle interventions like exercise, healthy eating, and stress management to reduce risks and empower healthier choices."
"The role of probiotics and prebiotics in gut health is gaining scientific attention. These dietary components support a healthy gut microbiome, which impacts digestion, immunity, and overall well-being. Incorporating them into the diet can be beneficial.","Probiotics and prebiotics are vital for gut health, supporting the microbiome for digestion, immunity, and overall well-being."
"The adoption of telehealth services has expanded access to medical care, especially during public health crises. Virtual consultations and remote monitoring offer convenience and reduce the burden on healthcare facilities. Digital literacy is important for patients.","Telehealth expands medical access, offering convenient virtual consultations and remote monitoring, but requires patient digital literacy."
"The importance of sun protection for skin health cannot be overstated. Excessive sun exposure increases the risk of skin cancer and premature aging. Using sunscreen, protective clothing, and seeking shade are essential preventative measures.","Sun protection is crucial for skin health, preventing skin cancer and aging; use sunscreen, protective clothing, and seek shade."
"A growing focus on personalized nutrition tailors dietary recommendations to individual needs and genetic profiles. This approach aims to optimize health outcomes and prevent disease more effectively. Research in nutrigenomics is advancing rapidly.","Personalized nutrition, tailored to individual genetics, aims to optimize health and prevent disease, driven by nutrigenomics research."
"The benefits of cold therapy, such as ice baths or cryotherapy, for muscle recovery and inflammation are widely explored. Athletes often use these techniques to accelerate healing and reduce soreness. Consultation with professionals is advised.","Cold therapy, like ice baths, aids muscle recovery and reduces inflammation for athletes; professional consultation is recommended."
"The increasing awareness of food allergies and intolerances has led to clearer labeling and more dietary options. Understanding triggers and cross-contamination is crucial for affected individuals. Education and awareness are key for safety.","Increased awareness of food allergies drives clearer labeling and dietary options; understanding triggers and cross-contamination is crucial."
"The integration of mental health support into primary care settings aims to provide holistic patient care. Addressing psychological well-being alongside physical health leads to better overall outcomes. Reducing stigma around mental health is a key goal.","Integrating mental health into primary care provides holistic care, improving outcomes and reducing stigma."
"The role of functional foods, enriched with health-promoting ingredients, in preventing chronic diseases is gaining recognition. These foods offer benefits beyond basic nutrition. Scientific evidence supports their efficacy for specific health conditions.","Functional foods, enriched with health-promoting ingredients, are recognized for preventing chronic diseases, offering benefits beyond basic nutrition."
"The importance of dental hygiene for overall health extends beyond just oral care. Poor dental health can be linked to systemic conditions like heart disease and diabetes. Regular brushing, flossing, and dental check-ups are essential.","Dental hygiene is crucial for overall health, linked to systemic conditions; regular brushing, flossing, and check-ups are essential."
"The growing popularity of outdoor fitness activities, such as trail running and open-water swimming, offers unique health benefits. Exercising in nature can improve mood, reduce stress, and provide a refreshing challenge. Safety precautions are important.","Outdoor fitness, like trail running, offers unique health benefits, improving mood, reducing stress, and providing challenges in nature."
"The concept of 'forest bathing' (Shinrin-yoku) involves spending time in nature to reduce stress and improve well-being. It promotes relaxation and a deeper connection with the natural environment. This practice is gaining recognition for its therapeutic benefits.","Forest bathing, or Shinrin-yoku, is a therapeutic practice of spending time in nature to reduce stress and improve well-being."
"Adventure tourism offers thrilling experiences like white-water rafting and paragliding, pushing physical and mental limits. It provides unique perspectives on landscapes and cultures, creating unforgettable memories. Safety and professional guidance are paramount.","Adventure tourism, like rafting and paragliding, pushes limits, offering unique perspectives and unforgettable memories with safety and guidance."
"The rise of ethical tourism focuses on respecting local cultures, economies, and environments. Travelers seek authentic experiences that benefit host communities. Choosing responsible operators and minimizing impact are key principles.","Ethical tourism emphasizes respecting local cultures, economies, and environments, promoting authentic experiences that benefit host communities."
"Digital detox trips encourage travelers to disconnect from technology and reconnect with themselves and their surroundings. These getaways promote mental well-being and stress reduction. Choosing remote or nature-focused destinations enhances the experience.","Digital detox trips promote mental well-being by encouraging technological disconnection and reconnecting with oneself and surroundings."
"Culinary tourism centers around exploring a region's food and drink, offering insights into local culture and traditions. Food tours, cooking classes, and tasting experiences provide immersive gastronomic adventures. It's a delicious way to experience a destination.","Culinary tourism explores a region's food and drink, offering cultural insights and immersive gastronomic adventures."
"Volunteer tourism combines travel with charitable work, allowing travelers to contribute to local communities. It offers a meaningful way to experience a destination while making a positive impact. Careful research into ethical organizations is important.","Volunteer tourism combines travel with charitable work, offering a meaningful way to experience destinations and make a positive impact."
"Space tourism is an emerging industry offering suborbital and orbital flights to private citizens. It represents a new frontier in travel, providing unprecedented views of Earth. Safety regulations and high costs are significant factors.","Space tourism, an emerging industry offering suborbital and orbital flights, provides unprecedented Earth views but faces safety and cost challenges."
"Heritage tourism focuses on visiting historical and cultural sites, preserving and promoting the past. It offers educational experiences and a deeper understanding of human history. Supporting local conservation efforts is an important aspect.","Heritage tourism involves visiting historical sites, offering educational experiences and promoting preservation of the past."
"Wellness tourism emphasizes travel for health and well-being, including spa retreats, yoga breaks, and medical tourism. It focuses on physical, mental, and spiritual rejuvenation. Choosing destinations with specialized services is key.","Wellness tourism focuses on travel for health and well-being, encompassing spa, yoga, and medical retreats for physical and mental rejuvenation."
"Wildlife tourism involves observing wild animals in their natural habitats, promoting conservation and education. Responsible practices avoid disturbing animals and support local ecosystems. Choosing ethical operators is crucial for sustainable wildlife encounters.","Wildlife tourism involves observing animals in natural habitats, promoting conservation and education; responsible practices and ethical operators are crucial."
"Gap year travel encourages young adults to explore the world, gain life experience, and develop new skills before higher education or career. It fosters independence, cultural awareness, and personal growth. Planning and budgeting are essential.","Gap year travel fosters independence, cultural awareness, and personal growth for young adults through world exploration before higher education."
"The impact of artificial intelligence on education is transforming learning methods and tools. AI-powered platforms offer personalized learning paths and adaptive assessments. Ethical considerations regarding data privacy and algorithmic bias are important.","AI is transforming education with personalized learning and adaptive assessments, raising concerns about data privacy and algorithmic bias."
"Inclusive education aims to provide equal learning opportunities for all students, regardless of their abilities or backgrounds. It fosters a supportive and diverse learning environment. Teacher training and adaptable curricula are crucial for success.","Inclusive education provides equal learning opportunities for all students, fostering supportive, diverse environments through teacher training and adaptable curricula."
"Gamification in education uses game-design elements and game principles in learning contexts. It enhances engagement, motivation, and knowledge retention. Designing effective gamified learning experiences requires careful pedagogical consideration.","Gamification in education increases engagement, motivation, and knowledge retention by integrating game design elements into learning."
"Experiential learning emphasizes hands-on activities and real-world experiences to foster deeper understanding. Students learn by doing, reflecting on their experiences, and applying knowledge in practical settings. Internships and field trips are examples.","Experiential learning uses hands-on activities and real-world experiences for deeper understanding, reflection, and practical knowledge application."
"Blended learning combines online digital media with traditional classroom methods, offering flexibility and diverse learning opportunities. It caters to different learning styles and paces. Effective integration requires thoughtful instructional design.","Blended learning combines online and traditional methods, offering flexible, diverse learning tailored to different styles, requiring thoughtful design."
"Microlearning delivers educational content in small, digestible units, ideal for busy learners and specific skill acquisition. It enhances retention and allows for on-demand learning. This approach is popular for professional development.","Microlearning delivers small, digestible educational content, enhancing retention and on-demand learning, popular for professional development."
"Competency-based education focuses on students mastering specific skills and knowledge rather than traditional time-based progression. It allows learners to advance at their own pace. Clear learning outcomes are central to this approach.","Competency-based education focuses on skill mastery and self-paced progression, prioritizing clear learning outcomes."
"The flipped classroom model reverses traditional teaching: students learn new content at home and apply knowledge in class. This frees up class time for active learning, discussions, and problem-solving. It requires student preparedness.","Flipped classrooms reverse traditional learning; students learn new content at home, applying knowledge in class for active learning."
"Digital citizenship education teaches responsible and ethical use of technology and the internet. It covers topics like online safety, privacy, and cyberbullying. Fostering positive digital behavior is crucial for navigating the online world.","Digital citizenship education teaches responsible technology use, covering online safety, privacy, and cyberbullying for positive digital behavior."
"The importance of inclusive sports programs cannot be overstated, providing opportunities for individuals of all abilities to participate. These programs foster physical activity, social inclusion, and a sense of belonging. Adapted equipment and coaching are often involved.","Inclusive sports programs offer physical activity, social inclusion, and belonging for all abilities, often using adapted equipment and coaching."
"The mental health benefits of regular exercise are well-documented, including reduced stress, anxiety, and depression. Physical activity releases endorphins and improves mood. Incorporating exercise into daily routines supports psychological well-being.","Regular exercise significantly reduces stress, anxiety, and depression by releasing endorphins, improving mood and supporting mental well-being."
"Youth sports play a crucial role in developing physical fitness, teamwork, and character. Participation teaches discipline, resilience, and sportsmanship. Parental involvement and positive coaching are essential for a healthy environment.","Youth sports develop fitness, teamwork, and character through discipline and sportsmanship, requiring positive parental and coaching involvement."
"The growth of adventure sports, such as rock climbing and mountain biking, offers thrilling challenges and connection with nature. These activities require specialized skills, equipment, and an understanding of risks. Proper training is essential.","Adventure sports like rock climbing offer thrilling, nature-connected challenges requiring specialized skills, equipment, and risk understanding."
"Sports psychology focuses on optimizing athletic performance and mental well-being in athletes. It addresses topics like motivation, anxiety, and focus. Mental training techniques are integral for achieving peak performance.","Sports psychology optimizes athletic performance and mental well-being through mental training, addressing motivation, anxiety, and focus."
"The increasing popularity of fitness apps and online personal training offers convenient ways to access exercise guidance. These digital platforms provide customized workouts, progress tracking, and expert advice. User engagement is key for consistent results.","Fitness apps and online training offer convenient, customized workouts, tracking, and expert advice, with user engagement crucial for results."
"Adaptive sports provide opportunities for individuals with disabilities to participate in athletic activities. These sports use modified rules, equipment, and facilities to ensure accessibility. They promote inclusion, physical activity, and empowerment.","Adaptive sports enable disabled individuals to participate through modified rules/equipment, promoting inclusion, activity, and empowerment."
"The role of nutrition in athletic performance is fundamental, providing the energy and nutrients needed for training and recovery. Proper fueling strategies enhance endurance, strength, and overall athletic potential. Hydration is equally important.","Nutrition is fundamental for athletic performance, providing energy and nutrients for training and recovery, enhancing endurance and strength."
